{
  "schema": "bcp.cross_project_catalog/1",
  "created_at": "2026-10-06T16:10:00Z",
  "projects": [
    {
      "schema": "bcp.project_record/1",
      "project_id": "TLIB",
      "display_name": "TLIB Hybrid V2",
      "aliases": [
        "TLIB",
        "Total Library"
      ],
      "profile": "KNOWLEDGE_CORPUS",
      "status": "BINDING_INCOMPLETE",
      "authority": {
        "engineering": "UNRESOLVED",
        "runtime": "PC",
        "artifacts": "UNRESOLVED",
        "conversation": "NON_AUTHORITATIVE"
      },
      "origins": {
        "local_roots": [
          {
            "status": "UNRESOLVED",
            "path": null,
            "authority": "UNRESOLVED"
          }
        ],
        "repos": [
          {
            "status": "UNRESOLVED",
            "repository": null,
            "branch": null,
            "path": null,
            "authority": "UNRESOLVED"
          }
        ],
        "drive_refs": []
      },
      "adapters": [
        "GITHUB_REPOSITORY",
        "BCP_NATIVE_PC"
      ],
      "resource_profile": {
        "resource_class": "R2_MEDIUM",
        "heavy_work": false,
        "offline_capable": true,
        "background_policy": "GREEN_ONLY"
      },
      "permission_profile": {
        "max_permission_class": "P2_PROJECT_MUTATION",
        "read_allowed": true,
        "project_write_policy": "POLICY",
        "system_modify_policy": "GATED"
      },
      "update_profile": {
        "mode": "PROJECT_DEFINED",
        "rollback_required": true,
        "channel": null
      },
      "head_revision": null,
      "coordinator_epoch": null,
      "source_revision": "TLIB_REPOSITORY_BINDING_UNRESOLVED_2026-10-06",
      "compatibility": {
        "legacy_authority_present": true,
        "migration_rule": "Historical deployment evidence exists, but Phase 8 does not infer a canonical source repository from audit references."
      },
      "updated_at": "2026-10-06T16:10:00Z"
    },
    {
      "schema": "bcp.project_record/1",
      "project_id": "EXCELLENTIA",
      "display_name": "Excellentia Study Hub",
      "aliases": [
        "Excellentia",
        "Excellentia Study Cockpit"
      ],
      "profile": "KNOWLEDGE_CORPUS",
      "status": "BINDING_INCOMPLETE",
      "authority": {
        "engineering": "GITHUB",
        "runtime": "PC",
        "artifacts": "MIXED",
        "conversation": "NON_AUTHORITATIVE"
      },
      "origins": {
        "local_roots": [
          {
            "status": "UNRESOLVED",
            "path": null,
            "authority": "UNRESOLVED"
          }
        ],
        "repos": [
          {
            "status": "BOUND",
            "repository": "Terminator364/ChatGPT-PC",
            "branch": "main",
            "path": "excellentia-study-cockpit",
            "authority": "ENGINEERING"
          }
        ],
        "drive_refs": []
      },
      "adapters": [
        "GITHUB_REPOSITORY",
        "BCP_NATIVE_PC"
      ],
      "resource_profile": {
        "resource_class": "R2_MEDIUM",
        "heavy_work": false,
        "offline_capable": true,
        "background_policy": "GREEN_ONLY"
      },
      "permission_profile": {
        "max_permission_class": "P2_PROJECT_MUTATION",
        "read_allowed": true,
        "project_write_policy": "POLICY",
        "system_modify_policy": "GATED"
      },
      "update_profile": {
        "mode": "PROJECT_DEFINED",
        "rollback_required": true,
        "channel": null
      },
      "head_revision": null,
      "coordinator_epoch": null,
      "source_revision": "7f3a04d4a597086e2505bfc5e31bc02497bd963e",
      "compatibility": {
        "legacy_authority_present": true,
        "migration_rule": "BCP owns orchestration/evidence; Excellentia keeps project-specific study state and release semantics."
      },
      "updated_at": "2026-10-06T16:10:00Z"
    },
    {
      "schema": "bcp.project_record/1",
      "project_id": "DELIVERY",
      "display_name": "ChatGPT Delivery",
      "aliases": [
        "Delivery",
        "ChatGPT Delivery"
      ],
      "profile": "DELIVERY_PROVIDER",
      "status": "BINDING_INCOMPLETE",
      "authority": {
        "engineering": "GITHUB",
        "runtime": "PC_DRIVE",
        "artifacts": "DRIVE",
        "conversation": "NON_AUTHORITATIVE"
      },
      "origins": {
        "local_roots": [
          {
            "status": "UNRESOLVED",
            "path": null,
            "authority": "UNRESOLVED"
          }
        ],
        "repos": [
          {
            "status": "BOUND",
            "repository": "Terminator364/ChatGPT-PC",
            "branch": "main",
            "path": "chatgpt-delivery",
            "authority": "ENGINEERING"
          }
        ],
        "drive_refs": []
      },
      "adapters": [
        "GITHUB_REPOSITORY",
        "BCP_NATIVE_PC"
      ],
      "resource_profile": {
        "resource_class": "R2_MEDIUM",
        "heavy_work": false,
        "offline_capable": false,
        "background_policy": "GREEN_ONLY"
      },
      "permission_profile": {
        "max_permission_class": "P2_PROJECT_MUTATION",
        "read_allowed": true,
        "project_write_policy": "POLICY",
        "system_modify_policy": "GATED"
      },
      "update_profile": {
        "mode": "PROJECT_DEFINED",
        "rollback_required": true,
        "channel": null
      },
      "head_revision": null,
      "coordinator_epoch": null,
      "source_revision": "7f3a04d4a597086e2505bfc5e31bc02497bd963e",
      "compatibility": {
        "legacy_authority_present": true,
        "migration_rule": "Delivery remains its own transport/provider implementation; BCP consumes typed Delivery capabilities rather than duplicating its queue/runtime."
      },
      "updated_at": "2026-10-06T16:10:00Z"
    },
    {
      "schema": "bcp.project_record/1",
      "project_id": "BUILDHUB",
      "display_name": "BuildHub",
      "aliases": [
        "BuildHub"
      ],
      "profile": "SPECIALIZED_EXECUTOR",
      "status": "BINDING_INCOMPLETE",
      "authority": {
        "engineering": "GITHUB",
        "runtime": "UNRESOLVED",
        "artifacts": "BUILDHUB",
        "conversation": "NON_AUTHORITATIVE"
      },
      "origins": {
        "local_roots": [
          {
            "status": "UNRESOLVED",
            "path": null,
            "authority": "UNRESOLVED"
          }
        ],
        "repos": [
          {
            "status": "BOUND",
            "repository": "Terminator364/BuildHub",
            "branch": "main",
            "path": null,
            "authority": "ENGINEERING"
          }
        ],
        "drive_refs": []
      },
      "adapters": [
        "GITHUB_REPOSITORY",
        "BCP_NATIVE_PC"
      ],
      "resource_profile": {
        "resource_class": "R2_MEDIUM",
        "heavy_work": true,
        "offline_capable": false,
        "background_policy": "GREEN_ONLY"
      },
      "permission_profile": {
        "max_permission_class": "P2_PROJECT_MUTATION",
        "read_allowed": true,
        "project_write_policy": "POLICY",
        "system_modify_policy": "GATED"
      },
      "update_profile": {
        "mode": "PROJECT_DEFINED",
        "rollback_required": true,
        "channel": null
      },
      "head_revision": null,
      "coordinator_epoch": null,
      "source_revision": "18ac5c048acfa6f190713239cd1611952d9ca24c",
      "compatibility": {
        "legacy_authority_present": true,
        "migration_rule": "BuildHub is a provider/executor candidate; repository presence alone does not certify live execution availability."
      },
      "updated_at": "2026-10-06T16:10:00Z"
    },
    {
      "schema": "bcp.project_record/1",
      "project_id": "PC_COMMAND",
      "display_name": "PC COMMAND",
      "aliases": [
        "PC Command",
        "PC-COMMAND"
      ],
      "profile": "SPECIALIZED_EXECUTOR",
      "status": "BINDING_INCOMPLETE",
      "authority": {
        "engineering": "UNRESOLVED",
        "runtime": "PC",
        "artifacts": "UNRESOLVED",
        "conversation": "NON_AUTHORITATIVE"
      },
      "origins": {
        "local_roots": [
          {
            "status": "UNRESOLVED",
            "path": null,
            "authority": "UNRESOLVED"
          }
        ],
        "repos": [
          {
            "status": "BOUND",
            "repository": "Terminator364/PC-COMMAND-STATE",
            "branch": "main",
            "path": null,
            "authority": "COMPATIBILITY"
          }
        ],
        "drive_refs": []
      },
      "adapters": [
        "GITHUB_REPOSITORY",
        "BCP_NATIVE_PC"
      ],
      "resource_profile": {
        "resource_class": "R2_MEDIUM",
        "heavy_work": false,
        "offline_capable": true,
        "background_policy": "GREEN_ONLY"
      },
      "permission_profile": {
        "max_permission_class": "P3_BOUNDED_SYSTEM_CHANGE",
        "read_allowed": true,
        "project_write_policy": "POLICY",
        "system_modify_policy": "GATED"
      },
      "update_profile": {
        "mode": "PROJECT_DEFINED",
        "rollback_required": true,
        "channel": null
      },
      "head_revision": null,
      "coordinator_epoch": null,
      "source_revision": "f10913f1fecc678a1c6ccc31758eb753cdb20924",
      "compatibility": {
        "legacy_authority_present": true,
        "migration_rule": "PC-COMMAND-STATE is observed as the private state bus, not asserted as engineering source."
      },
      "updated_at": "2026-10-06T16:10:00Z"
    },
    {
      "schema": "bcp.project_record/1",
      "project_id": "PHONEMOUSE",
      "display_name": "PhoneMouse",
      "aliases": [
        "PhoneMouse"
      ],
      "profile": "SPECIALIZED_EXECUTOR",
      "status": "BINDING_INCOMPLETE",
      "authority": {
        "engineering": "GITHUB",
        "runtime": "PC",
        "artifacts": "UNRESOLVED",
        "conversation": "NON_AUTHORITATIVE"
      },
      "origins": {
        "local_roots": [
          {